Netflix,Tirador,TIRADORNETFLIX,125,4.9,Misterio
Netflix,El Lorax,ELLORAXNETFLIX,86,4.85,Infantil
Disney,Raya y el ultimo dragon,RAYADISNEY,107,4,Fantasia
Disney,Encanto,ENCANTODISNEY,112,4.8,Fantasia
HBO,Harry Potter: La camara de los secretos,HPCAMARASECRETOSHBO,161,3.7,Fantasia
HBO,Harry Potter: El prisionero de azkaban,HPAZKBANSHBO,142,4.5,Fantasia
Crunchyroll,Saga of Tanya the Evil: The movie,TANYACRUNCHYROLL,99,4.8,Accion
Crunchyroll,Code Geass: Lelouch of the rebellion,CODEGEASSCRUNCHYROLL,134,4.9,Misterio
